

================================================================
== Vitis HLS Report for 'FIR_filter_1'
================================================================
* Date:           Sun Nov 23 16:17:32 2025

* Version:        2024.2 (Build 5238294 on Nov  8 2024)
* Project:        FIR_Cascade_HLS
* Solution:       hls (Vivado IP Flow Target)
* Product family: zynquplus
* Target device:  xck26-sfvc784-2LV-c


================================================================
== Performance Estimates
================================================================
+ Timing: 
    * Summary: 
    +--------+----------+----------+------------+
    |  Clock |  Target  | Estimated| Uncertainty|
    +--------+----------+----------+------------+
    |ap_clk  |  10.00 ns|  3.025 ns|     2.70 ns|
    +--------+----------+----------+------------+

+ Latency: 
    * Summary: 
    +---------+---------+-----------+-----------+-----+-----+---------+
    |  Latency (cycles) |   Latency (absolute)  |  Interval | Pipeline|
    |   min   |   max   |    min    |    max    | min | max |   Type  |
    +---------+---------+-----------+-----------+-----+-----+---------+
    |        4|        4|  40.000 ns|  40.000 ns|    1|    1|      yes|
    +---------+---------+-----------+-----------+-----+-----+---------+

    + Detail: 
        * Instance: 
        N/A

        * Loop: 
        N/A

============================================================
+ Verbose Summary: Synthesis Manager
============================================================
InlineROM: 1
ExposeGlobal: 0
============================================================
+ Verbose Summary: CDFG Model
============================================================
IsTopModel: 0
ResetActiveHigh: 1
IsCombinational: 0
IsDatapathOnly: 0
HasWiredReturn: 1
HasMFsm: 2
HasVarLatency: 0
IsPipeline: 1
IsRtlPipelined: 1
IsInstanceOverlapped: 0
IsDontTouch: 0
HasImplIP: 0
IsGatedGlobalClock: 0

+ Individual pipeline summary: 
  * Pipeline-0: initiation interval (II) = 1, depth = 5


============================================================
+ Verbose Summary: Schedule
============================================================
* Number of FSM states : 5
* Pipeline : 1
  Pipeline-0 : II = 1, D = 5, States = { 1 2 3 4 5 }
* Dataflow Pipeline: 0

* FSM state transitions: 
1 --> 2 
2 --> 3 
3 --> 4 
4 --> 5 
5 --> 

* FSM state operations: 

State 1 <SV = 0> <Delay = 0.99>
ST_1 : Operation 6 [1/1] (0.00ns)   --->   "%FIR_delays_write_read = read i16 @_ssdm_op_Read.ap_auto.i16, i16 %FIR_delays_write" [FIR_HLS.cpp:58]   --->   Operation 6 'read' 'FIR_delays_write_read' <Predicate = true> <Delay = 0.00>
ST_1 : Operation 7 [1/1] (0.00ns)   --->   "%FIR_coe_0_2_val_read = read i13 @_ssdm_op_Read.ap_auto.i13, i13 %FIR_coe_0_2_val" [FIR_HLS.cpp:58]   --->   Operation 7 'read' 'FIR_coe_0_2_val_read' <Predicate = true> <Delay = 0.00>
ST_1 : Operation 8 [1/1] (0.00ns)   --->   "%FIR_coe_0_0_val_read = read i13 @_ssdm_op_Read.ap_auto.i13, i13 %FIR_coe_0_0_val" [FIR_HLS.cpp:58]   --->   Operation 8 'read' 'FIR_coe_0_0_val_read' <Predicate = true> <Delay = 0.00>
ST_1 : Operation 9 [1/1] (0.00ns)   --->   "%FIR_delays_read_25 = read i16 @_ssdm_op_Read.ap_auto.i16, i16 %FIR_delays_read_28" [FIR_HLS.cpp:58]   --->   Operation 9 'read' 'FIR_delays_read_25' <Predicate = true> <Delay = 0.00>
ST_1 : Operation 10 [1/1] (0.00ns)   --->   "%FIR_delays_read_26 = read i16 @_ssdm_op_Read.ap_auto.i16, i16 %FIR_delays_read" [FIR_HLS.cpp:58]   --->   Operation 10 'read' 'FIR_delays_read_26' <Predicate = true> <Delay = 0.00>
ST_1 : Operation 11 [1/1] (0.00ns)   --->   "%FIR_delays_write_cast = sext i16 %FIR_delays_write_read" [FIR_HLS.cpp:58]   --->   Operation 11 'sext' 'FIR_delays_write_cast' <Predicate = true> <Delay = 0.00>
ST_1 : Operation 12 [1/1] (0.00ns)   --->   "%FIR_coe_0_0_val_cast = sext i13 %FIR_coe_0_0_val_read" [FIR_HLS.cpp:58]   --->   Operation 12 'sext' 'FIR_coe_0_0_val_cast' <Predicate = true> <Delay = 0.00>
ST_1 : Operation 13 [3/3] (0.99ns) (grouped into DSP with root node tmp)   --->   "%FIR_accu32 = mul i29 %FIR_delays_write_cast, i29 %FIR_coe_0_0_val_cast" [FIR_HLS.cpp:58]   --->   Operation 13 'mul' 'FIR_accu32' <Predicate = true> <Delay = 0.99> <CoreInst = "DSP48">   --->   Core 124 'DSP48' <Latency = 3> <II = 1> <Delay = 0.53> <IPBlock> <Opcode : '' 'add' 'sub' 'mul' 'select'> <InPorts = 0> <OutPorts = 1> <Sync> <CReg>

State 2 <SV = 1> <Delay = 0.99>
ST_2 : Operation 14 [2/3] (0.99ns) (grouped into DSP with root node tmp)   --->   "%FIR_accu32 = mul i29 %FIR_delays_write_cast, i29 %FIR_coe_0_0_val_cast" [FIR_HLS.cpp:58]   --->   Operation 14 'mul' 'FIR_accu32' <Predicate = true> <Delay = 0.99> <CoreInst = "DSP48">   --->   Core 124 'DSP48' <Latency = 3> <II = 1> <Delay = 0.53> <IPBlock> <Opcode : '' 'add' 'sub' 'mul' 'select'> <InPorts = 0> <OutPorts = 1> <Sync> <CReg>
ST_2 : Operation 15 [1/1] (0.00ns)   --->   "%sext_ln66 = sext i16 %FIR_delays_read_25" [FIR_HLS.cpp:66]   --->   Operation 15 'sext' 'sext_ln66' <Predicate = true> <Delay = 0.00>
ST_2 : Operation 16 [3/3] (0.99ns) (grouped into DSP with root node FIR_accu32_2)   --->   "%mul_ln66 = mul i32 %sext_ln66, i32 30446" [FIR_HLS.cpp:66]   --->   Operation 16 'mul' 'mul_ln66' <Predicate = true> <Delay = 0.99> <CoreInst = "DSP48">   --->   Core 124 'DSP48' <Latency = 3> <II = 1> <Delay = 0.53> <IPBlock> <Opcode : '' 'add' 'sub' 'mul' 'select'> <InPorts = 0> <OutPorts = 1> <Sync> <CReg>

State 3 <SV = 2> <Delay = 3.02>
ST_3 : Operation 17 [1/3] (0.00ns) (grouped into DSP with root node tmp)   --->   "%FIR_accu32 = mul i29 %FIR_delays_write_cast, i29 %FIR_coe_0_0_val_cast" [FIR_HLS.cpp:58]   --->   Operation 17 'mul' 'FIR_accu32' <Predicate = true> <Delay = 0.00> <CoreInst = "DSP48">   --->   Core 124 'DSP48' <Latency = 3> <II = 1> <Delay = 0.53> <IPBlock> <Opcode : '' 'add' 'sub' 'mul' 'select'> <InPorts = 0> <OutPorts = 1> <Sync> <CReg>
ST_3 : Operation 18 [1/1] (0.00ns)   --->   "%sext_ln61 = sext i13 %FIR_coe_0_2_val_read" [FIR_HLS.cpp:61]   --->   Operation 18 'sext' 'sext_ln61' <Predicate = true> <Delay = 0.00>
ST_3 : Operation 19 [2/3] (0.99ns) (grouped into DSP with root node FIR_accu32_2)   --->   "%mul_ln66 = mul i32 %sext_ln66, i32 30446" [FIR_HLS.cpp:66]   --->   Operation 19 'mul' 'mul_ln66' <Predicate = true> <Delay = 0.99> <CoreInst = "DSP48">   --->   Core 124 'DSP48' <Latency = 3> <II = 1> <Delay = 0.53> <IPBlock> <Opcode : '' 'add' 'sub' 'mul' 'select'> <InPorts = 0> <OutPorts = 1> <Sync> <CReg>
ST_3 : Operation 20 [1/1] (0.00ns)   --->   "%FIR_delays_read_cast = sext i16 %FIR_delays_read_26" [FIR_HLS.cpp:58]   --->   Operation 20 'sext' 'FIR_delays_read_cast' <Predicate = true> <Delay = 0.00>
ST_3 : Operation 21 [1/1] (2.38ns)   --->   "%mul_ln66_1 = mul i29 %FIR_delays_read_cast, i29 %sext_ln61" [FIR_HLS.cpp:58]   --->   Operation 21 'mul' 'mul_ln66_1' <Predicate = true> <Delay = 2.38> <CoreInst = "Multiplier">   --->   Core 3 'Multiplier' <Latency = 0> <II = 1> <Delay = 2.38> <FuncUnit> <Opcode : 'mul'> <InPorts = 2> <OutPorts = 1>
ST_3 : Operation 22 [2/2] (0.64ns) (root node of the DSP)   --->   "%tmp = add i29 %mul_ln66_1, i29 %FIR_accu32" [FIR_HLS.cpp:58]   --->   Operation 22 'add' 'tmp' <Predicate = true> <Delay = 0.64> <CoreInst = "DSP48">   --->   Core 124 'DSP48' <Latency = 3> <II = 1> <Delay = 0.53> <IPBlock> <Opcode : '' 'add' 'sub' 'mul' 'select'> <InPorts = 0> <OutPorts = 1> <Sync> <CReg>

State 4 <SV = 3> <Delay = 1.29>
ST_4 : Operation 23 [1/3] (0.00ns) (grouped into DSP with root node FIR_accu32_2)   --->   "%mul_ln66 = mul i32 %sext_ln66, i32 30446" [FIR_HLS.cpp:66]   --->   Operation 23 'mul' 'mul_ln66' <Predicate = true> <Delay = 0.00> <CoreInst = "DSP48">   --->   Core 124 'DSP48' <Latency = 3> <II = 1> <Delay = 0.53> <IPBlock> <Opcode : '' 'add' 'sub' 'mul' 'select'> <InPorts = 0> <OutPorts = 1> <Sync> <CReg>
ST_4 : Operation 24 [1/2] (0.64ns) (root node of the DSP)   --->   "%tmp = add i29 %mul_ln66_1, i29 %FIR_accu32" [FIR_HLS.cpp:58]   --->   Operation 24 'add' 'tmp' <Predicate = true> <Delay = 0.64> <CoreInst = "DSP48">   --->   Core 124 'DSP48' <Latency = 3> <II = 1> <Delay = 0.53> <IPBlock> <Opcode : '' 'add' 'sub' 'mul' 'select'> <InPorts = 0> <OutPorts = 1> <Sync> <CReg>
ST_4 : Operation 25 [1/1] (0.00ns)   --->   "%tmp_1 = bitconcatenate i30 @_ssdm_op_BitConcatenate.i30.i29.i1, i29 %tmp, i1 0" [FIR_HLS.cpp:58]   --->   Operation 25 'bitconcatenate' 'tmp_1' <Predicate = true> <Delay = 0.00>
ST_4 : Operation 26 [1/1] (0.00ns)   --->   "%tmp1 = sext i30 %tmp_1" [FIR_HLS.cpp:58]   --->   Operation 26 'sext' 'tmp1' <Predicate = true> <Delay = 0.00>
ST_4 : Operation 27 [2/2] (0.64ns) (root node of the DSP)   --->   "%FIR_accu32_2 = add i32 %tmp1, i32 %mul_ln66" [FIR_HLS.cpp:66]   --->   Operation 27 'add' 'FIR_accu32_2' <Predicate = true> <Delay = 0.64> <CoreInst = "DSP48">   --->   Core 124 'DSP48' <Latency = 3> <II = 1> <Delay = 0.53> <IPBlock> <Opcode : '' 'add' 'sub' 'mul' 'select'> <InPorts = 0> <OutPorts = 1> <Sync> <CReg>

State 5 <SV = 4> <Delay = 0.64>
ST_5 : Operation 28 [1/1] (0.00ns)   --->   "%specpipeline_ln58 = specpipeline void @_ssdm_op_SpecPipeline, i32 4294967295, i32 0, i32 0, i32 0, void @empty_3" [FIR_HLS.cpp:58]   --->   Operation 28 'specpipeline' 'specpipeline_ln58' <Predicate = true> <Delay = 0.00>
ST_5 : Operation 29 [1/2] (0.64ns) (root node of the DSP)   --->   "%FIR_accu32_2 = add i32 %tmp1, i32 %mul_ln66" [FIR_HLS.cpp:66]   --->   Operation 29 'add' 'FIR_accu32_2' <Predicate = true> <Delay = 0.64> <CoreInst = "DSP48">   --->   Core 124 'DSP48' <Latency = 3> <II = 1> <Delay = 0.53> <IPBlock> <Opcode : '' 'add' 'sub' 'mul' 'select'> <InPorts = 0> <OutPorts = 1> <Sync> <CReg>
ST_5 : Operation 30 [1/1] (0.00ns)   --->   "%y = partselect i16 @_ssdm_op_PartSelect.i16.i32.i32.i32, i32 %FIR_accu32_2, i32 16, i32 31" [FIR_HLS.cpp:68]   --->   Operation 30 'partselect' 'y' <Predicate = true> <Delay = 0.00>
ST_5 : Operation 31 [1/1] (0.00ns)   --->   "%newret = insertvalue i48 <undef>, i16 %y" [FIR_HLS.cpp:68]   --->   Operation 31 'insertvalue' 'newret' <Predicate = true> <Delay = 0.00>
ST_5 : Operation 32 [1/1] (0.00ns)   --->   "%newret2 = insertvalue i48 %newret, i16 %FIR_delays_read_25" [FIR_HLS.cpp:68]   --->   Operation 32 'insertvalue' 'newret2' <Predicate = true> <Delay = 0.00>
ST_5 : Operation 33 [1/1] (0.00ns)   --->   "%newret4 = insertvalue i48 %newret2, i16 %FIR_delays_write_read" [FIR_HLS.cpp:68]   --->   Operation 33 'insertvalue' 'newret4' <Predicate = true> <Delay = 0.00>
ST_5 : Operation 34 [1/1] (0.00ns)   --->   "%ret_ln68 = ret i48 %newret4" [FIR_HLS.cpp:68]   --->   Operation 34 'ret' 'ret_ln68' <Predicate = true> <Delay = 0.00>


============================================================
+ Verbose Summary: Timing violations
============================================================
Target clock period: 10.000ns, clock uncertainty: 2.700ns.

 <State 1>: 0.996ns
The critical path consists of the following:
	wire read operation ('FIR_delays', FIR_HLS.cpp:58) on port 'FIR_delays_write' (FIR_HLS.cpp:58) [6]  (0.000 ns)
	'mul' operation 29 bit of DSP[20] ('FIR_accu32', FIR_HLS.cpp:58) [14]  (0.996 ns)

 <State 2>: 0.996ns
The critical path consists of the following:
	'mul' operation 29 bit of DSP[20] ('FIR_accu32', FIR_HLS.cpp:58) [14]  (0.996 ns)

 <State 3>: 3.025ns
The critical path consists of the following:
	'mul' operation 29 bit ('mul_ln66_1', FIR_HLS.cpp:58) [19]  (2.380 ns)
	'add' operation 29 bit of DSP[20] ('tmp', FIR_HLS.cpp:58) [20]  (0.645 ns)

 <State 4>: 1.290ns
The critical path consists of the following:
	'add' operation 29 bit of DSP[20] ('tmp', FIR_HLS.cpp:58) [20]  (0.645 ns)
	'add' operation 32 bit of DSP[23] ('FIR_accu32_2', FIR_HLS.cpp:66) [23]  (0.645 ns)

 <State 5>: 0.645ns
The critical path consists of the following:
	'add' operation 32 bit of DSP[23] ('FIR_accu32_2', FIR_HLS.cpp:66) [23]  (0.645 ns)


============================================================
+ Verbose Summary: Binding
============================================================
N/A
* FSMD analyzer results:
  - Output states:
 - Input state : 
  - Chain level:
	State 1
	State 2
	State 3
	State 4
	State 5


============================================================
+ Verbose Summary: Datapath Resource usage 
============================================================
N/A
