

================================================================
== Vitis HLS Report for 'Direct_FIR_DSP_Pipeline_VITIS_LOOP_33_2'
================================================================
* Date:           Sun Nov 16 15:35:49 2025

* Version:        2024.2 (Build 5238294 on Nov  8 2024)
* Project:        Direct_FIR_DSP
* Solution:       hls (Vivado IP Flow Target)
* Product family: zynquplus
* Target device:  xck26-sfvc784-2LV-c


================================================================
== Performance Estimates
================================================================
+ Timing: 
    * Summary: 
    +--------+----------+----------+------------+
    |  Clock |  Target  | Estimated| Uncertainty|
    +--------+----------+----------+------------+
    |ap_clk  |  10.00 ns|  2.474 ns|     2.70 ns|
    +--------+----------+----------+------------+

+ Latency: 
    * Summary: 
    +---------+---------+----------+----------+-----+-----+------------------------------------------------+
    |  Latency (cycles) |  Latency (absolute) |  Interval |                    Pipeline                    |
    |   min   |   max   |    min   |    max   | min | max |                      Type                      |
    +---------+---------+----------+----------+-----+-----+------------------------------------------------+
    |      393|      393|  3.930 us|  3.930 us|  392|  392|  loop auto-rewind stp (delay=0 clock cycles(s))|
    +---------+---------+----------+----------+-----+-----+------------------------------------------------+

    + Detail: 
        * Instance: 
        N/A

        * Loop: 
        +-------------------+---------+---------+----------+-----------+-----------+------+----------+
        |                   |  Latency (cycles) | Iteration|  Initiation Interval  | Trip |          |
        |     Loop Name     |   min   |   max   |  Latency |  achieved |   target  | Count| Pipelined|
        +-------------------+---------+---------+----------+-----------+-----------+------+----------+
        |- VITIS_LOOP_33_2  |      391|      391|         2|          1|          1|   391|       yes|
        +-------------------+---------+---------+----------+-----------+-----------+------+----------+

============================================================
+ Verbose Summary: Synthesis Manager
============================================================
InlineROM: 1
ExposeGlobal: 0
============================================================
+ Verbose Summary: CDFG Model
============================================================
IsTopModel: 0
ResetActiveHigh: 1
IsCombinational: 0
IsDatapathOnly: 0
HasWiredReturn: 1
HasMFsm: 2
HasVarLatency: 1
IsPipeline: 0
IsRtlPipelined: 0
IsInstanceOverlapped: 0
IsDontTouch: 0
HasImplIP: 0
IsGatedGlobalClock: 0

+ Individual pipeline summary: 
  * Pipeline-0: initiation interval (II) = 1, depth = 2


============================================================
+ Verbose Summary: Schedule
============================================================
* Number of FSM states : 2
* Pipeline : 1
  Pipeline-0 : II = 1, D = 2, States = { 1 2 }
* Dataflow Pipeline: 0

* FSM state transitions: 
1 --> 2 
2 --> 

* FSM state operations: 

State 1 <SV = 0> <Delay = 1.66>
ST_1 : Operation 5 [1/1] (0.00ns)   --->   "%i = alloca i32 1" [FIR_HLS.cpp:22->FIR_HLS.cpp:13]   --->   Operation 5 'alloca' 'i' <Predicate = true> <Delay = 0.00>
ST_1 : Operation 6 [1/1] (0.42ns)   --->   "%store_ln22 = store i9 1, i9 %i" [FIR_HLS.cpp:22->FIR_HLS.cpp:13]   --->   Operation 6 'store' 'store_ln22' <Predicate = true> <Delay = 0.42>
ST_1 : Operation 7 [1/1] (0.00ns)   --->   "%br_ln0 = br void %for.inc24.i"   --->   Operation 7 'br' 'br_ln0' <Predicate = true> <Delay = 0.00>
ST_1 : Operation 8 [1/1] (0.00ns)   --->   "%i_1 = load i9 %i" [FIR_HLS.cpp:34->FIR_HLS.cpp:13]   --->   Operation 8 'load' 'i_1' <Predicate = true> <Delay = 0.00>
ST_1 : Operation 9 [1/1] (0.77ns)   --->   "%icmp_ln33 = icmp_eq  i9 %i_1, i9 392" [FIR_HLS.cpp:33->FIR_HLS.cpp:13]   --->   Operation 9 'icmp' 'icmp_ln33' <Predicate = true> <Delay = 0.77> <CoreInst = "Cmp">   --->   Core 9 'Cmp' <Latency = 0> <II = 1> <Delay = 0.77> <FuncUnit> <Opcode : 'seteq' 'setne' 'setle' 'setge' 'setlt' 'setgt'> <InPorts = 2> <OutPorts = 1>
ST_1 : Operation 10 [1/1] (0.00ns)   --->   "%br_ln33 = br i1 %icmp_ln33, void %for.inc24.i.split, void %_Z10FIR_filterPsPKsssi.exit.exitStub" [FIR_HLS.cpp:33->FIR_HLS.cpp:13]   --->   Operation 10 'br' 'br_ln33' <Predicate = true> <Delay = 0.00>
ST_1 : Operation 11 [1/1] (0.00ns)   --->   "%zext_ln33 = zext i9 %i_1" [FIR_HLS.cpp:33->FIR_HLS.cpp:13]   --->   Operation 11 'zext' 'zext_ln33' <Predicate = (!icmp_ln33)> <Delay = 0.00>
ST_1 : Operation 12 [1/1] (0.00ns)   --->   "%H_filter_FIR_addr = getelementptr i16 %H_filter_FIR, i64 0, i64 %zext_ln33" [FIR_HLS.cpp:34->FIR_HLS.cpp:13]   --->   Operation 12 'getelementptr' 'H_filter_FIR_addr' <Predicate = (!icmp_ln33)> <Delay = 0.00>
ST_1 : Operation 13 [2/2] (1.23ns)   --->   "%H_filter_FIR_load = load i9 %H_filter_FIR_addr" [FIR_HLS.cpp:34->FIR_HLS.cpp:13]   --->   Operation 13 'load' 'H_filter_FIR_load' <Predicate = (!icmp_ln33)> <Delay = 1.23> <CoreInst = "RAM">   --->   Core 82 'RAM' <Latency = 1> <II = 1> <Delay = 1.23> <Storage> <Opcode : 'load' 'store'> <Ports = 2> <Width = 16> <Depth = 392> <RAM>
ST_1 : Operation 14 [1/1] (0.77ns)   --->   "%add_ln33 = add i9 %i_1, i9 1" [FIR_HLS.cpp:33->FIR_HLS.cpp:13]   --->   Operation 14 'add' 'add_ln33' <Predicate = (!icmp_ln33)> <Delay = 0.77> <CoreInst = "Adder">   --->   Core 1 'Adder' <Latency = 0> <II = 1> <Delay = 0.77> <FuncUnit> <Opcode : 'add' 'sub'> <InPorts = 2> <OutPorts = 1>
ST_1 : Operation 15 [1/1] (0.42ns)   --->   "%store_ln22 = store i9 %add_ln33, i9 %i" [FIR_HLS.cpp:22->FIR_HLS.cpp:13]   --->   Operation 15 'store' 'store_ln22' <Predicate = (!icmp_ln33)> <Delay = 0.42>
ST_1 : Operation 25 [1/1] (0.42ns)   --->   "%ret_ln0 = ret"   --->   Operation 25 'ret' 'ret_ln0' <Predicate = (icmp_ln33)> <Delay = 0.42>

State 2 <SV = 1> <Delay = 2.47>
ST_2 : Operation 16 [1/1] (0.00ns)   --->   "%specpipeline_ln22 = specpipeline void @_ssdm_op_SpecPipeline, i32 4294967295, i32 0, i32 0, i32 0, void @empty_1" [FIR_HLS.cpp:22->FIR_HLS.cpp:13]   --->   Operation 16 'specpipeline' 'specpipeline_ln22' <Predicate = true> <Delay = 0.00>
ST_2 : Operation 17 [1/1] (0.00ns)   --->   "%speclooptripcount_ln22 = speclooptripcount void @_ssdm_op_SpecLoopTripCount, i64 391, i64 391, i64 391" [FIR_HLS.cpp:22->FIR_HLS.cpp:13]   --->   Operation 17 'speclooptripcount' 'speclooptripcount_ln22' <Predicate = true> <Delay = 0.00>
ST_2 : Operation 18 [1/1] (0.00ns)   --->   "%specloopname_ln33 = specloopname void @_ssdm_op_SpecLoopName, void @empty_4" [FIR_HLS.cpp:33->FIR_HLS.cpp:13]   --->   Operation 18 'specloopname' 'specloopname_ln33' <Predicate = true> <Delay = 0.00>
ST_2 : Operation 19 [1/2] ( I:1.23ns O:1.23ns )   --->   "%H_filter_FIR_load = load i9 %H_filter_FIR_addr" [FIR_HLS.cpp:34->FIR_HLS.cpp:13]   --->   Operation 19 'load' 'H_filter_FIR_load' <Predicate = true> <Delay = 1.23> <CoreInst = "RAM">   --->   Core 82 'RAM' <Latency = 1> <II = 1> <Delay = 1.23> <Storage> <Opcode : 'load' 'store'> <Ports = 2> <Width = 16> <Depth = 392> <RAM>
ST_2 : Operation 20 [1/1] (0.77ns)   --->   "%add_ln34 = add i9 %i_1, i9 511" [FIR_HLS.cpp:34->FIR_HLS.cpp:13]   --->   Operation 20 'add' 'add_ln34' <Predicate = true> <Delay = 0.77> <CoreInst = "Adder">   --->   Core 1 'Adder' <Latency = 0> <II = 1> <Delay = 0.77> <FuncUnit> <Opcode : 'add' 'sub'> <InPorts = 2> <OutPorts = 1>
ST_2 : Operation 21 [1/1] (0.00ns)   --->   "%zext_ln34 = zext i9 %add_ln34" [FIR_HLS.cpp:34->FIR_HLS.cpp:13]   --->   Operation 21 'zext' 'zext_ln34' <Predicate = true> <Delay = 0.00>
ST_2 : Operation 22 [1/1] (0.00ns)   --->   "%H_filter_FIR_addr_1 = getelementptr i16 %H_filter_FIR, i64 0, i64 %zext_ln34" [FIR_HLS.cpp:34->FIR_HLS.cpp:13]   --->   Operation 22 'getelementptr' 'H_filter_FIR_addr_1' <Predicate = true> <Delay = 0.00>
ST_2 : Operation 23 [1/1] ( I:1.23ns O:1.23ns )   --->   "%store_ln34 = store i16 %H_filter_FIR_load, i9 %H_filter_FIR_addr_1" [FIR_HLS.cpp:34->FIR_HLS.cpp:13]   --->   Operation 23 'store' 'store_ln34' <Predicate = true> <Delay = 1.23> <CoreInst = "RAM">   --->   Core 82 'RAM' <Latency = 1> <II = 1> <Delay = 1.23> <Storage> <Opcode : 'load' 'store'> <Ports = 2> <Width = 16> <Depth = 392> <RAM>
ST_2 : Operation 24 [1/1] (0.00ns)   --->   "%br_ln33 = br void %for.inc24.i" [FIR_HLS.cpp:33->FIR_HLS.cpp:13]   --->   Operation 24 'br' 'br_ln33' <Predicate = true> <Delay = 0.00>


============================================================
+ Verbose Summary: Timing violations
============================================================
Target clock period: 10.000ns, clock uncertainty: 2.700ns.

 <State 1>: 1.664ns
The critical path consists of the following:
	'store' operation 0 bit ('store_ln22', FIR_HLS.cpp:22->FIR_HLS.cpp:13) of constant 1 on local variable 'i', FIR_HLS.cpp:22->FIR_HLS.cpp:13 [3]  (0.427 ns)
	'load' operation 9 bit ('i', FIR_HLS.cpp:34->FIR_HLS.cpp:13) on local variable 'i', FIR_HLS.cpp:22->FIR_HLS.cpp:13 [6]  (0.000 ns)
	'getelementptr' operation 9 bit ('H_filter_FIR_addr', FIR_HLS.cpp:34->FIR_HLS.cpp:13) [14]  (0.000 ns)
	'load' operation 16 bit ('H_filter_FIR_load', FIR_HLS.cpp:34->FIR_HLS.cpp:13) on array 'H_filter_FIR' [15]  (1.237 ns)

 <State 2>: 2.474ns
The critical path consists of the following:
	'load' operation 16 bit ('H_filter_FIR_load', FIR_HLS.cpp:34->FIR_HLS.cpp:13) on array 'H_filter_FIR' [15]  (1.237 ns)
	'store' operation 0 bit ('store_ln34', FIR_HLS.cpp:34->FIR_HLS.cpp:13) of variable 'H_filter_FIR_load', FIR_HLS.cpp:34->FIR_HLS.cpp:13 on array 'H_filter_FIR' [19]  (1.237 ns)


============================================================
+ Verbose Summary: Binding
============================================================
N/A
* FSMD analyzer results:
  - Output states:
 - Input state : 
  - Chain level:
	State 1
	State 2


============================================================
+ Verbose Summary: Datapath Resource usage 
============================================================
N/A
